{
  "$generated": true,
  "$source": "pipeline-derived",
  "$schema": "./timezones.schema.json",
  "$note": "TIER 2 codegen-ready spec — produced by tools/geo-data-pipeline from contracts/geo/src-data/*.spec.json (Tier 1). Matches the canonical entity record shape; consumed directly by codegen (.NET SourceGen + TS emitter — Tier 3) to produce concrete entity types. Do NOT hand-edit — re-run `pnpm geo:refresh` to regenerate.",
  "catalogVersion": "0.1.0",
  "generatedAt": "2026-05-19T18:14:37.998Z",
  "entries": [
    {
      "ianaIdentifier": "Africa/Abidjan",
      "displayName": "Africa — Abidjan",
      "currentStdOffsetMinutes": 0,
      "currentDstOffsetMinutes": null,
      "currentStdAbbrev": "GMT",
      "currentDstAbbrev": null,
      "countryISO31661Alpha2Code": "CI",
      "coApplicableCountryISO31661Alpha2Codes": [
        "BF",
        "GH",
        "GM",
        "GN",
        "IS",
        "ML",
        "MR",
        "SH",
        "SL",
        "SN",
        "TG"
      ],
      "aliases": [
        "Africa/Accra",
        "Africa/Bamako",
        "Africa/Banjul",
        "Africa/Conakry",
        "Africa/Dakar",
        "Africa/Freetown",
        "Africa/Lome",
        "Africa/Nouakchott",
        "Africa/Ouagadougou",
        "Africa/Timbuktu",
        "Atlantic/Reykjavik",
        "Atlantic/St_Helena",
        "Iceland"
      ]
    },
    {
      "ianaIdentifier": "Africa/Algiers",
      "displayName": "Africa — Algiers",
      "currentStdOffsetMinutes": 60,
      "currentDstOffsetMinutes": null,
      "currentStdAbbrev": "GMT+1",
      "currentDstAbbrev": null,
      "countryISO31661Alpha2Code": "DZ",
      "coApplicableCountryISO31661Alpha2Codes": [],
      "aliases": []
    },
    {
      "ianaIdentifier": "Africa/Bissau",
      "displayName": "Africa — Bissau",
      "currentStdOffsetMinutes": 0,
      "currentDstOffsetMinutes": null,
      "currentStdAbbrev": "GMT",
      "currentDstAbbrev": null,
      "countryISO31661Alpha2Code": "GW",
      "coApplicableCountryISO31661Alpha2Codes": [],
      "aliases": []
    },
    {
      "ianaIdentifier": "Africa/Cairo",
      "displayName": "Africa — Cairo",
      "currentStdOffsetMinutes": 120,
      "currentDstOffsetMinutes": 180,
      "currentStdAbbrev": "GMT+2",
      "currentDstAbbrev": "GMT+3",
      "countryISO31661Alpha2Code": "EG",
      "coApplicableCountryISO31661Alpha2Codes": [],
      "aliases": [
        "Egypt"
      ]
    },
    {
      "ianaIdentifier": "Africa/Casablanca",
      "displayName": "Africa — Casablanca",
      "currentStdOffsetMinutes": 60,
      "currentDstOffsetMinutes": null,
      "currentStdAbbrev": "GMT+1",
      "currentDstAbbrev": null,
      "countryISO31661Alpha2Code": "MA",
      "coApplicableCountryISO31661Alpha2Codes": [],
      "aliases": []
    },
    {
      "ianaIdentifier": "Africa/Ceuta",
      "displayName": "Africa — Ceuta",
      "currentStdOffsetMinutes": 60,
      "currentDstOffsetMinutes": 120,
      "currentStdAbbrev": "GMT+1",
      "currentDstAbbrev": "GMT+2",
      "countryISO31661Alpha2Code": "ES",
      "coApplicableCountryISO31661Alpha2Codes": [],
      "aliases": []
    },
    {
      "ianaIdentifier": "Africa/El_Aaiun",
      "displayName": "Africa — El Aaiun",
      "currentStdOffsetMinutes": 60,
      "currentDstOffsetMinutes": null,
      "currentStdAbbrev": "GMT+1",
      "currentDstAbbrev": null,
      "countryISO31661Alpha2Code": "EH",
      "coApplicableCountryISO31661Alpha2Codes": [],
      "aliases": []
    },
    {
      "ianaIdentifier": "Africa/Johannesburg",
      "displayName": "Africa — Johannesburg",
      "currentStdOffsetMinutes": 120,
      "currentDstOffsetMinutes": null,
      "currentStdAbbrev": "GMT+2",
      "currentDstAbbrev": null,
      "countryISO31661Alpha2Code": "ZA",
      "coApplicableCountryISO31661Alpha2Codes": [
        "LS",
        "SZ"
      ],
      "aliases": [
        "Africa/Maseru",
        "Africa/Mbabane"
      ]
    },
    {
      "ianaIdentifier": "Africa/Juba",
      "displayName": "Africa — Juba",
      "currentStdOffsetMinutes": 120,
      "currentDstOffsetMinutes": null,
      "currentStdAbbrev": "GMT+2",
      "currentDstAbbrev": null,
      "countryISO31661Alpha2Code": "SS",
      "coApplicableCountryISO31661Alpha2Codes": [],
      "aliases": []
    },
    {
      "ianaIdentifier": "Africa/Khartoum",
      "displayName": "Africa — Khartoum",
      "currentStdOffsetMinutes": 120,
      "currentDstOffsetMinutes": null,
      "currentStdAbbrev": "GMT+2",
      "currentDstAbbrev": null,
      "countryISO31661Alpha2Code": "SD",
      "coApplicableCountryISO31661Alpha2Codes": [],
      "aliases": []
    },
    {
      "ianaIdentifier": "Africa/Lagos",
      "displayName": "Africa — Lagos",
      "currentStdOffsetMinutes": 60,
      "currentDstOffsetMinutes": null,
      "currentStdAbbrev": "GMT+1",
      "currentDstAbbrev": null,
      "countryISO31661Alpha2Code": "NG",
      "coApplicableCountryISO31661Alpha2Codes": [
        "AO",
        "BJ",
        "CD",
        "CF",
        "CG",
        "CM",
        "GA",
        "GQ",
        "NE"
      ],
      "aliases": [
        "Africa/Bangui",
        "Africa/Brazzaville",
        "Africa/Douala",
        "Africa/Kinshasa",
        "Africa/Libreville",
        "Africa/Luanda",
        "Africa/Malabo",
        "Africa/Niamey",
        "Africa/Porto-Novo"
      ]
    },
    {
      "ianaIdentifier": "Africa/Maputo",
      "displayName": "Africa — Maputo",
      "currentStdOffsetMinutes": 120,
      "currentDstOffsetMinutes": null,
      "currentStdAbbrev": "GMT+2",
      "currentDstAbbrev": null,
      "countryISO31661Alpha2Code": "MZ",
      "coApplicableCountryISO31661Alpha2Codes": [
        "BI",
        "BW",
        "CD",
        "MW",
        "RW",
        "ZM",
        "ZW"
      ],
      "aliases": [
        "Africa/Blantyre",
        "Africa/Bujumbura",
        "Africa/Gaborone",
        "Africa/Harare",
        "Africa/Kigali",
        "Africa/Lubumbashi",
        "Africa/Lusaka"
      ]
    },
    {
      "ianaIdentifier": "Africa/Monrovia",
      "displayName": "Africa — Monrovia",
      "currentStdOffsetMinutes": 0,
      "currentDstOffsetMinutes": null,
      "currentStdAbbrev": "GMT",
      "currentDstAbbrev": null,
      "countryISO31661Alpha2Code": "LR",
      "coApplicableCountryISO31661Alpha2Codes": [],
      "aliases": []
    },
    {
      "ianaIdentifier": "Africa/Nairobi",
      "displayName": "Africa — Nairobi",
      "currentStdOffsetMinutes": 180,
      "currentDstOffsetMinutes": null,
      "currentStdAbbrev": "GMT+3",
      "currentDstAbbrev": null,
      "countryISO31661Alpha2Code": "KE",
      "coApplicableCountryISO31661Alpha2Codes": [
        "DJ",
        "ER",
        "ET",
        "KM",
        "MG",
        "SO",
        "TZ",
        "UG",
        "YT"
      ],
      "aliases": [
        "Africa/Addis_Ababa",
        "Africa/Asmara",
        "Africa/Asmera",
        "Africa/Dar_es_Salaam",
        "Africa/Djibouti",
        "Africa/Kampala",
        "Africa/Mogadishu",
        "Indian/Antananarivo",
        "Indian/Comoro",
        "Indian/Mayotte"
      ]
    },
    {
      "ianaIdentifier": "Africa/Ndjamena",
      "displayName": "Africa — Ndjamena",
      "currentStdOffsetMinutes": 60,
      "currentDstOffsetMinutes": null,
      "currentStdAbbrev": "GMT+1",
      "currentDstAbbrev": null,
      "countryISO31661Alpha2Code": "TD",
      "coApplicableCountryISO31661Alpha2Codes": [],
      "aliases": []
    },
    {
      "ianaIdentifier": "Africa/Sao_Tome",
      "displayName": "Africa — Sao Tome",
      "currentStdOffsetMinutes": 0,
      "currentDstOffsetMinutes": null,
      "currentStdAbbrev": "GMT",
      "currentDstAbbrev": null,
      "countryISO31661Alpha2Code": "ST",
      "coApplicableCountryISO31661Alpha2Codes": [],
      "aliases": []
    },
    {
      "ianaIdentifier": "Africa/Tripoli",
      "displayName": "Africa — Tripoli",
      "currentStdOffsetMinutes": 120,
      "currentDstOffsetMinutes": null,
      "currentStdAbbrev": "GMT+2",
      "currentDstAbbrev": null,
      "countryISO31661Alpha2Code": "LY",
      "coApplicableCountryISO31661Alpha2Codes": [],
      "aliases": [
        "Libya"
      ]
    },
    {
      "ianaIdentifier": "Africa/Tunis",
      "displayName": "Africa — Tunis",
      "currentStdOffsetMinutes": 60,
      "currentDstOffsetMinutes": null,
      "currentStdAbbrev": "GMT+1",
      "currentDstAbbrev": null,
      "countryISO31661Alpha2Code": "TN",
      "coApplicableCountryISO31661Alpha2Codes": [],
      "aliases": []
    },
    {
      "ianaIdentifier": "Africa/Windhoek",
      "displayName": "Africa — Windhoek",
      "currentStdOffsetMinutes": 120,
      "currentDstOffsetMinutes": null,
      "currentStdAbbrev": "GMT+2",
      "currentDstAbbrev": null,
      "countryISO31661Alpha2Code": "NA",
      "coApplicableCountryISO31661Alpha2Codes": [],
      "aliases": []
    },
    {
      "ianaIdentifier": "America/Adak",
      "displayName": "America — Adak",
      "currentStdOffsetMinutes": -600,
      "currentDstOffsetMinutes": -540,
      "currentStdAbbrev": "HAST",
      "currentDstAbbrev": "HADT",
      "countryISO31661Alpha2Code": "US",
      "coApplicableCountryISO31661Alpha2Codes": [],
      "aliases": [
        "America/Atka",
        "US/Aleutian"
      ]
    },
    {
      "ianaIdentifier": "America/Anchorage",
      "displayName": "America — Anchorage",
      "currentStdOffsetMinutes": -540,
      "currentDstOffsetMinutes": -480,
      "currentStdAbbrev": "AKST",
      "currentDstAbbrev": "AKDT",
      "countryISO31661Alpha2Code": "US",
      "coApplicableCountryISO31661Alpha2Codes": [],
      "aliases": [
        "US/Alaska"
      ]
    },
    {
      "ianaIdentifier": "America/Araguaina",
      "displayName": "America — Araguaina",
      "currentStdOffsetMinutes": -180,
      "currentDstOffsetMinutes": null,
      "currentStdAbbrev": "GMT-3",
      "currentDstAbbrev": null,